id,url,url_hash,site_id,title,content,html,excerpt,published_at,crawled_at,word_count,crawl_status,error_message,created_at,updated_at,screenshot_url,og_title,og_description,og_image,og_type,og_site_name,meta_description,meta_keywords,user_id,extraction_status,extraction_error
83b936e0-6ea6-40f7-9e5b-136b2f001313,https://spiderum.com/bai-dang/HAU-NGO-TRUONG-LOAN-QUYEN-1-LOAN-CHUA-HOI-4-DA-DIEN-HAC-TAM-or-owB4cgr2U1nd,885849ab28604abb66a2e7eb841841c759e052a32791d437fdc8a5553c60e850,6f161388-a1e9-4976-ab11-e56f3c317f62,HẬU NGÔ TRƯỜNG LOẠN - QUYỂN 1: LOẠN CHÚA. HỒI 4: ĐA DIỆN HẮC TÂM | 多面黑心,"宦海風濤翻逆浪，
人間義氣化妖氛。
誰知一念成興廢，
萬里乾坤盡是塵。“Hoạn hải phong đào phiên nghịch lãng,
Nhân gian nghĩa khí hoá yêu phân.
Thùy tri nhất niệm thành hưng phế,
Vạn lý càn khôn tận thị trần.”Tại thư phòng trong Dương Phủ, Dương Huy đóng cửa suốt ba ngày. Bên ngoài, quân canh đổi gác lặng lẽ như không muốn đánh thức ngọn lửa đang cháy âm ỉ bên trong.Trên bàn, ba phong thư, mỗi cái niêm bằng sáp đỏ, dấu triện in hình long phụng quấn nhau. Lời lẽ viết bằng loại chữ hành thảo xứ Bắc, uốn lượn như nước chảy mây trôi nhưng lẩn khuất một khí quyết liệt như gươm đã rút nửa khỏi vỏ.Ông dừng tay, nhìn ra sân. Gió chướng Đông Bắc thổi về, mùi sắt gỉ tanh nồng. Ánh mắt
ông ánh lên một tia sáng lạnh:— Kỳ lạ thật! mọi ngày, trong thành đều vang vọng tiếng bước chân dồn dập. Sao đêm nay lại im ắng thế? Là Lã Xử Bình đã chủ quan hay hắn đang làm đại sự gì chăng?Trầm ngâm một lúc rồi ông tặc lưới:— Dù hắn có làm gì, thì tên cũng đã lên dây. Không thể lùi nữa. Ta không tin, hào kiệt hợp lực, lại thua con cáo già ấy.Ông ra lệnh:— Chuyển mật thư cho Trần Lãm ở Bố Hải Khẩu, cho Phạm Mạn ở Nam Sách, cho Phong Át tại Đằng Châu. Trà Hương, một canh giờ sau khi thư đến.Phạm Mạn cầm thư, tay nắm chặt đến mức dấu sáp đỏ in hằn lên tay áo.— Cuối cùng, cũng đến lúc.Ông bước ra thềm, nhìn xuống đoàn thân binh đang chỉnh giáp:— Lệnh cho tất cả chuẩn bị trong hai ngày. Không nói lý do. Ta sẽ dẫn quân theo đường sông Thiên Đức, hội cùng quân Trần Minh Công tại bến Dục Tú.Một viên tướng bên cạnh hỏi nhỏ:— Bẩm Đô Đốc, nếu dân có hỏi thì phải làm sao?Phạm Mạn ngẩng đầu, ánh mắt như sét bổ vào trời chiều:— Bảo dân: giữ thóc, cất lúa, cấm ai chạy loạn. Ai loan tin thất thiệt, xử như gian tế. Trà Hương không bỏ đất, không nhường dân. Khi ta trở về, hoặc là khải hoàn, hoặc là nằm dưới đất.Phạm Phong Át đọc thư xong, không nói một lời. Ông ngồi im bên án, tay cầm bầu rượu,
rót một chén đầy, rồi nghiêng ra đất:— Kính rượu cho nghĩa huynh Đinh Dự, một người liêm chính mà chết oan. Nay em mượn gươm, thay huynh đòi lại công đạo.Ông quay lại, nói lớn:— Gọi toàn bộ tướng soái vào sảnh nghị sự. Đằng Châu từ nay dứt đường phòng thủ, chỉ còn đường tiến đánh.Tại thành Kỳ Bố, trong đại sảnh phủ Trần Minh Công.
Trần Lãm đứng trước bản đồ, tay chỉ vào các lộ dẫn về Cổ Loa, ánh mắt trầm ngâm. Đinh Bộ Lĩnh bước vào, giáp trụ chỉnh tề, nhưng vẻ mặt lại đầy quyết tâm.Đinh Bộ Lĩnh quỳ xuống, thưa:— Nghĩa phụ, lần này xuất binh đánh Cổ Loa, xin cho con đi theo. Lã Xử Bình tàn bạo, con nguyện dùng máu mình rửa sạch oan khuất cho thúc phụ và muôn dân!Trần Lãm quay lại, ánh mắt vừa nghiêm nghị vừa ẩn chứa sự thương mến. Ông bước đến, đỡ Lĩnh dậy, nói:— Lĩnh, ta hiểu lòng con. Nhưng lần này, con không thể đi cùng ta. Cổ Loa là hang hùm, Lã Xử Bình là kẻ đa nghi, tàn độc. Cuộc chiến này không chỉ là trận đánh, mà là ván cờ sống chết. Nếu ta thất bại, Bố Hải Khẩu sẽ không còn ai trấn giữ.Đinh Bộ Lĩnh cau mày, giọng kiên định:— Nghĩa phụ, con không sợ chết! Nếu cha con cùng ngã xuống, chí lớn của chúng ta sẽ thành tro bụi. Nhưng nếu con ở lại, lòng con không cam! Thiên hạ đang loạn, dân chúng lầm than, con muốn tận mắt nhìn Lã Xử Bình đền tội!Trần Lãm đặt tay lên vai Lĩnh, ánh mắt sáng rực như ngọn lửa:— Chí của con không phải chỉ để giết một Lã Xử Bình. Ta thấy trong mắt con ngọn lửa của bậc đế vương. Ta và Phạm Mạn, Phong Át đánh trận này vì trung nghĩa, nhưng con… con phải nhìn xa hơn. Thiên hạ không chỉ cần dẹp loạn, mà cần một người thống nhất giang sơn, chấm
dứt thời chia rẽ. Nếu ta ngã xuống, con phải giữ vững Bố Hải Khẩu, chờ thời cơ. Đừng để máu thúc phụ con đổ xuống vô nghĩa.Nói rồi, ông rút kiếm. Nghía sống lưỡi rồi nói tiếp:— Lần này đi một là chiến thắng vinh hiển. Hai là xác phơi
cỏ nội. Muôn đời mang tiếng gian tặc. Ta không thể mạo hiểm đưa con vào chỗ chết.Đinh Bộ Lĩnh cúi đầu, hai tay siết chặt, giọng nghẹn ngào:— Nghĩa phụ…
Con hiểu rồi. Con sẽ ở lại, giữ vững đất này. Nhưng xin cha bảo trọng. Nếu cha không trở về, con thề sẽ lấy đầu Lã Xử Bình, thống nhất giang sơn, để muôn dân không còn chịu khổ!Trần Lãm gật đầu, ánh mắt thoáng một tia tự hào:— Tốt lắm, Lĩnh. Ta tin con. Hãy nhớ: kẻ làm đại sự không chỉ cần dũng, mà cần trí. Thời của con sẽ đến, nhưng không phải hôm nay.Nói rồi, Trần Lãm quay lại, vung tay ra lệnh:— Phát binh! Hội quân tại bến Dục Tú!***Dưới cờ hiệu thêu chữ Nghĩa của Trần Lãm, ba vạn quân hội
tụ tại bến Dục Tú. Phía sau là cờ Tham Chính Đô Đốc cùng Bạch Hổ Tướng Quân bay phần phật trong gió chiến.Quân Động Giang do Đỗ Cảnh Thạc dẫn đầu áp sát đồn Tiên Hội
từ phía nam. Phong Châu dưới cờ hiệu Kiều Công Hãn, Vũ Ninh do Nguyễn Quốc Khanh, ba đạo Nguyễn Gia: Tiên Du, Phù Liệt, Tam Đái do Nguyễn Thủ Tiệp dẫn binh cùng hai em áp sát Bắc Môn từ cánh bắc. Đường Lâm do Ngô Nhật Khánh dẫn đầu áp sát Tây MônDương Huy thấy các cánh quân đã vây chặt thành, quân triều đình lại không thấy ai ra chống. Trong lòng thoáng chút bất an. Nhưng cũng gạt đi mà lấy lại khí thế. Đứng trước bá quan trung nghĩa. Ông dương kiếm:— Các vị vốn là trọng thần. Phò tá tiên vương cũng đã lâu. Nay Lã Xử Bình lại thay Dương Tam Kha nhiễu loạn
triều cương, chèn ép thiên tử. Các vị, có những người quen việc binh đao. Cũng có những người lại chuyên việc triều chính. Tất thẩy tụ hợp ở đây quả là điều đáng quý. Nay, thời cơ đã điểm. Cơ hội trời cho, hãy cùng ta đi mở cửa thành cho nghĩa quân tràn vào. Lấy đầu phản tặc.Bá quan đồng thanh hô lớn:— RỘNG MỞ CỬA THÀNH, LẤY ĐẦU PHẢN TẶC.Nói rồi, đoàn người kéo nhau tiến ra Bắc Môn. Đám lính gác thấy đoàn đại thần thì tay run bần bật. Phan Tú rút gươm:— Mau mở cửa thành. Kẻ nào trái lệnh… chém.Lính giữ thành nhanh chống làm theo. Cánh cửa kinh thành kêu lên lạch cạch từng tiếng nặng nề.Dương Huy lập tức ra hiệu lệnh. Ba đạo Tiên Du, Phù Liệt, Tam Đái tiên phong, mở đợt đánh thẳng vào kinh sư. Cửa thành Cổ Loa vốn kiên cố, nhưng đêm đó, cổng chính lại bật mở. Ba đạo quân tiến vào như nước lũ tràn đê. Trống trận vang trời. Cờ xí rợp đất.Nguyễn Thủ Tiệp cưỡi voi, dẫn tượng binh đi đầu, bên tả có Nguyễn Khoan, bên hữu là Nguyễn Siêu cưỡi chiến mã tiếp ứng. Cả ba như hổ xuống đồng, vượt qua chín vòng tường cao, đánh thẳng vào trung tâm thành nội. Quân thủ thành tuy chỉ vài ngàn, nhưng chín
vòng thành đã tạo ra thế thủ khó vượt. Quân Nguyễn Gia cũng tổn thất không ít.Trong thành, dân chúng Cổ Loa hoảng loạn chạy trốn, kẻ ôm con, người dìu mẹ, tiếng khóc vang vọng khắp ngõ nhỏ.Nhưng dù quân triều đình có chống trả quyết liệt đến đâu, sức ép của Nguyễn Gia cũng không thể ngăn chặn. Chẳng mấy chốc, đã áp sát hoàng cung.Thấy Nguyễn Gia thắng lớn. Quân triều đình cũng chẳng có bao nhiêu. Những tưởng sẽ có huyết chiến, nhưng lại vô cùng thuận. Dương Huy cau mày hỏi các bá quan :— Kỳ lạ, sao có thể dễ dàng đến thế?Vừa dứt lời. Cổng thành Nam Môn cũng bật mở, cánh quân Động Giang tràn vào. Cảnh Thạc vừa vào thành đã ra lệnh cho Đỗ Thanh Long:—  Thanh Long tướng quân, mau đem quân trấn thủ Tây Môn. Kẻ nào dám công hạ, giết không tha.Y quay sang Trần Hùng, Văn Quý ra lệnh:— Bạch Hổ tướng quân. Ngươi cũng ở lại, đống cổng, trấn thủ Nam Môn. Huyền Vũ tướng quân đem quân ra trấn giữ Đông Quan, kẻ nào xâm phạm, cứ giết không tha.Ra lệnh cho hai tướng xong, y lại nói tiếp :— Chu Tước. Dẫn toàn quân theo ta, tiến về hoàng cung.Thủ Tiệp cùng hai anh em vừa xông vào hoàng cung, bỗng đâu tiếng hô vang vọng từ phía nam. Quân Đỗ Cảnh Thạc tiến tới với khí thế hừng hực. Không nói không rằng, đánh vào quân của Nguyễn gia. Binh sĩ Nguyễn gia vừa mới thở được một chút thì bị đánh úp. Toàn quân hoảng loạn, mặc cho quân Động Giang đang sung sức chém giết. Thủ Tiệp, Nguyễn Khoan, Nguyễn Siêu nhìn ra. Thấy quân mình đang bị tàn sát thì mặt mày biến sắc.
Nguyễn Khoan thấy cờ hiệu Đỗ Cảnh Công thì gầm lên:— Thằng giặc một tai Cảnh Thạc lật mặt rồi. Thất phu gian trá.Nguyễn Siêu thấy thế liền ra củng cố trận tuyến nhưng bất thành. Đại thế đã không còn, bèn bất lực quay về nói với Thủ Tiệp:— Anh hai, chúng khỏe mạnh. Ta mệt mỏi, không thể chống.Thủ Tiệp đứng xững người từ đầu, tay xiết chặt chuôi kiếm. Giọng vang vọng như sấm :— Gian tặc một tai, thất phu bội ước. Hắn nhờ ta giúp rồi đâm ta một nhát thật đau…Dương Huy đứng cùng các đại thần liền lên tiếng:— Cơ sự thế này, ta cũng không lường trước được. Tướng quân mau rút, bảo toàn tánh mạng. Nếu Cảnh Thạc đánh tới… ta e, ba anh em ngài cũng vong mạng. Thủ Tiệp nghe vậy lại hỏi :— Còn ngài và các đại thần thì sao ?Huy đáp :— Ngài chớ lo. Thằng giặc ấy có muốn làm vua thì cũng không thể giết đại thần. Ta còn có Quốc Khanh, dẫn quân Vũ Ninh ở ngoài Bắc Môn.Thủ Tiệp gật đầu rồi dẫn tàn quân chạy ra cửa Bắc.Thế nhưng, khi vừa ra thành. Ba anh em lại bị quân Phong Châu vây đánh. Tổn thất quá nửa. Nguyễn Khoan cầm binh tinh nhuệ, toan mở đường máu nhưng gặp phải Hoàng Định quá dũng mãnh. Tình thế vô cùng nguy ngập. Thủ Tiệp lại ngửa mặt lên trời than :— Trời hại ta rồi. Chẳng nhẽ Nguyễn gia tuyệt đường nơi đây sao?Nguyễn Siêu lay vai anh mà nói:— Anh hai chớ buông tay. Em cùng các tướng sẽ mở đường máu giúp anh.Thủ Tiệp lắc đầu:— Trời muốn diệt ta rồi, ta thật ngu dốt khi không đề phòng hai tên giặc ấy.Ba anh em ôm nhau, nước mắt lưng trồng giữa vòng tròn
phòng thủ. Bên ngoài là quân Phong Châu đang xiết chặt. Tưởng như tình thế đã định.
Thế nhưng, một đạo tập kích hậu quân Phong Châu. Tiên
phong là Nguyễn Quốc Khanh, cờ hiệu Vũ Ninh. Phía sau là Dương Huy, đã kịp đuổi
theo vì sợ Thủ Tiệp bị Công Hãn truy sát.Dương Huy lớn tiếng mắng Kiều Công Hãn:— Tiểu nhân. Ngươi đối đãi với kẻ tiên phong diệt giặc
như vậy sao?Công Hãn cười lớn :— Người không vì mình, trời chu đất diệt. Chẳng phải ngài cũng muốn diệt họ Nguyễn sao?Ba anh em đang bị vây khốn, thấy quân ứng cứu thì vội lên ngựa phản kích. Thế nhưng, khi nghe Công Hãn nói vậy. Thủ Tiệp lại quắc mắt nhìn Dương Huy:— Dương đại nhân. Sự tình là thế thật sao ?Dương Huy nói lớn với Thủ Tiệp:— Chớ mắc mưu gian tặc. Ta cũng chẳng ngờ Công Hãn lại trở mặt. Ta đến để cứu ngươi. Nói rồi, Huy phất tay. Quốc Khanh dẫn quân tràn vào mở đường máu. Công Hãn thấy vậy, liền nói với Hoàng Định:— Cứ giao tranh thế này thì quân ta tổn thất không ít. Mau cho quân tiến vào Bắc Môn.Quân Phong Châu tạm rút về Gia Lương. Ba anh em Nguyễn Gia được cứu. Thu nhặt lại khá nhiều tan quân. Sau trận chiến Thủ Tiệp đối diện Dương Huy. Nhẹ giọng hỏi:— Ngài cũng địn...",,...,2025-11-05 03:21:19.129+00,2025-11-05 03:21:22.849982+00,5726,success,,2025-11-05 03:21:22.849982+00,2025-11-05 03:21:22.849982+00,http://localhost:54321/storage/v1/object/public/article-screenshots/885849ab28604abb66a2e7eb841841c759e052a32791d437fdc8a5553c60e850.jpg,HẬU NGÔ TRƯỜNG LOẠN - QUYỂN 1: LOẠN CHÚA. HỒI 4: ĐA DIỆN HẮC TÂM | 多面黑心,...,https://images.spiderum.com/sp-images/84a66b50b99511f081b60bea32e6fd82.png,website,Spiderum,...,,a0eebc99-9c0b-4ef8-bb6d-6bb9bd380a11,pending,
