id,url,url_hash,site_id,title,content,html,excerpt,published_at,crawled_at,word_count,crawl_status,error_message,created_at,updated_at,screenshot_url,og_title,og_description,og_image,og_type,og_site_name,meta_description,meta_keywords,user_id,extraction_status,extraction_error
0575fe31-581f-4651-a54d-947cccf01a78,https://spiderum.com/bai-dang/Nuoi-day-tre-o-Viet-Nam-Xung-dot-giua-Gia-tri-Ca-nhan-va-Chuan-muc-Cong-dong-ZCO05qR69ntj,749d7c56c734de44e4ac87887d86e66278ecd4b16a0e87155a68c2ccd4ccfdb1,6f161388-a1e9-4976-ab11-e56f3c317f62,Nuôi dạy trẻ ở Việt Nam: Xung đột giữa Giá trị Cá nhân và Chuẩn mực Cộng đồng,"""Tôi là một người quyết tâm không cho con 4 tuổi nghiện điện thoại. Con trai tôi rất ngoan trừ một điểm là cháu rất hiếu động và hay hỏi mọi thứ, đôi khi khiến người lớn khó chịu vì những câu hỏi Tại sao, nhưng gia đình tôi thì coi đó là điều bình thường của độ tuổi. Nhưng khi ra ngoài, ví dụ ngồi trên taxi, hay gặp họ hàng, sự ồn ào của cháu làm mọi người khó chịu và luôn nhắc tôi cho con xem điện thoại để cháu yên lặng một chút. Tuy nhiên điều này lại xung đột với nguyên tắc dạy con của tôi. Hãy tư vấn cho tôi...""""Hai con tôi đều học cấp 2 tại một trường gần nhà. Để chuẩn bị cho văn nghệ trường, 2 cháu đề tham gia. Tuy nhiên, khi đến sớm đón 2 cháu để xem thành quả tập luyện, tôi rất shock vì các động tác nhảy lắc hông, ngoáy mông hay tập trung vào khoe những bộ phận nhạy cảm... mà khi tôi lên hỏi nhóm phụ huynh và cô giáo phụ trách đội thì chỉ nhận được câu đây là xu hướng của giới trẻ, bố mẹ không nên quá bảo thủ... Vậy tôi có bảo thủ thật không? Tôi không còn muốn cho con tham gia nữa nhưng sợ con bị tẩy chay hoặc mất vui chỉ vì sự lo lắng của người mẹ...""Nếu bạn từng gặp hay đồng cảm với những người mẹ trong câu chuyện trên, thì chúc mừng rằng bạn đã đạt tới một ý chí giáo dục có nhận thức cao:1. Không để con phụ thuộc vào điện thoại hay bất cứ xu hướng nào.2. Chấp nhận sự hiếu động, tò mò và nói nhiều như một biểu hiện phát triển bình thường của trẻ. Không chấp nhận để trẻ vô thức trở thành cái máy lặp lại mọi hành vi của xã hội.Đây là quan điểm gần với triết lý giáo dục Nordic pedagogy, người ta tin rằng trẻ em cần được ""là chính mình"" trước khi được ""dạy nên người"".Tuy nhiên, khi người mẹ bước ra khỏi “vùng giá trị” của mình, tức là không gian gia đình, họ luôn thật đơn lẻ khi phải đối diện áp lực đồng thuận xã hội: mọi người đều muốn trẻ “ngoan, dễ chịu”... Sự căng thẳng này tạo nên một trạng thái đạo đức cô đơn (moral loneliness): Họ biết mình đúng, nhưng bị vây quanh bởi những người nghĩ ""làm mẹ sai"" chỉ vì không hành xử theo “khuôn số đông”.Trong nhiều xã hội châu Á, bao gồm Việt Nam, định nghĩa “đứa trẻ ngoan” thường gắn liền với sự im lặng và phục tùng. Trẻ càng ít nói, càng biết “ngồi yên”, càng được xem là có giáo dục. Chuẩn mực này không bắt nguồn từ hiểu biết tâm lý học phát triển, mà từ nhu cầu trật tự của người lớn: trẻ ngoan vì khiến người khác thấy dễ chịu.Ở đây, tính ngoan trở thành một biểu tượng của trật tự xã hội hơn là phẩm chất đạo đức thực sự. Đứa trẻ không được khuyến khích “là chính mình”, mà được dạy cách “thu nhỏ mình lại” để vừa vặn với sự kiên nhẫn giới hạn của người lớn.
Sự ồn ào, biểu hiện tự nhiên của năng lượng sống và quá trình nhận thức, bị nhìn bằng con mắt nghi ngờ. Người lớn quên rằng trẻ em không học bằng im lặng, chúng học bằng thử, hỏi, sai và nói liên tục.Từ góc nhìn xã hội học, đây là dấu hiệu của một xã hội chưa phân biệt rõ giữa “trật tự” và “phát triển”. Một xã hội trưởng thành không phải là nơi trẻ em luôn im lặng, mà là nơi người lớn có đủ năng lực để chấp nhận sự hỗn loạn tạm thời của quá trình trưởng thành.
Sự im lặng cưỡng ép, trong trường hợp này, là một loại bạo lực mềm... nó bóp nghẹt khả năng tự biểu đạt và niềm tin tự nhiên của trẻ rằng “thế giới muốn lắng nghe mình”.Khi người ta khuyên một người mẹ “cho cháu xem điện thoại để cháu yên”, ""cho cháu hòa nhập với xu hướng""...họ không chỉ đang gợi ý một cách giải quyết. Họ đang tái khẳng định một chuẩn mực xã hội ngầm: không nên gây bất tiện cho người khác, và công nghệ là công cụ hiệu quả nhất để đạt điều đó.Chiếc điện thoại giờ đây không còn là một thiết bị giải trí cá nhân. Nó trở thành một hình thức kiểm soát xã hội mềm mại, một công cụ để duy trì “trật tự” trong không gian công cộng.
Đó là lý do các nhà nghiên cứu Bắc Âu gọi hiện tượng này là “digital sedation” (an thần kỹ thuật số): việc sử dụng màn hình như một chất gây tê cảm xúc, giúp người lớn kiểm soát hành vi của trẻ mà không cần tương tác, lắng nghe hay đồng hành.Trẻ, trong khi đó, được “an thần” không chỉ khỏi sự hiếu động, mà khỏi toàn bộ thế giới cảm xúc và trải nghiệm thật.
Những nghiên cứu tâm lý học phát triển tại Thụy Điển và Đan Mạch trong thập kỷ qua đã chỉ ra: trẻ tiếp xúc màn hình sớm (dưới 4 tuổi) có xu hướng giảm khả năng tự điều tiết cảm xúc, trì hoãn thỏa mãn và giảm thời gian chú ý thực tế. Quan trọng hơn, trẻ dễ đồng nhất sự yên tĩnh với cảm giác được yêu thương, vì “khi con yên, mẹ cười”.
Đây là nền tảng hình thành một tâm lý phụ thuộc phục tùng kéo dài đến tuổi trưởng thành.Nếu ta nhìn hiện tượng này ở tầng sâu hơn, “điện thoại” không chỉ thay thế cho ""giải trí"", nó thay thế vai trò của người lớn trong việc điều tiết và hướng dẫn.
Một người mẹ chọn không cho con xem điện thoại, chọn cho con khác số đông trong bối cảnh này, không chỉ đang bảo vệ con khỏi công nghệ, mà còn chống lại sự thoái hóa của năng lực nuôi dạy người.Người mẹ trong câu chuyện đang trải nghiệm một dạng “cô đơn đạo đức” (moral loneliness) cảm giác bị cô lập không phải vì sai, mà vì làm đúng giữa một cộng đồng quen sống dễ dãi.
Cô tin rằng hiếu động là tự nhiên, nhưng mọi ánh mắt xung quanh lại xem đó là thiếu dạy. Cô biết việc từ chối xu hướng ""lắc đít"" giúp con phát triển lành mạnh, nhưng lại bị xem là “cứng nhắc”.Trong một xã hội đề cao tính cộng đồng, sự khác biệt của cô bị nhìn như sự thách thức chuẩn mực. Tuy nhiên, trong xã hội học tiến bộ, đó chính là hành động đạo đức cá nhân: bảo vệ giá trị con người ngay cả khi nó làm người khác khó chịu.Sự khó chịu đó, xét đến cùng, là phản ứng tự vệ của một cộng đồng chưa quen đối diện với tự do cá nhân. Một đứa trẻ nói nhiều, hỏi nhiều, chính là phép thử cho khả năng chịu đựng của người lớn đối với sự khác biệt và tự do. Nếu người lớn không chịu nổi một đứa trẻ hiếu động, xã hội ấy cũng khó mà chấp nhận một công dân phản biện, sáng tạo hay dám nói lên điều khác biệt.Để cân bằng giữa niềm tin cá nhân và áp lực cộng đồng, cần đến một loại “trí tuệ mềm” khả năng giữ vững nguyên tắc mà không làm đứt mạch quan hệ xã hội.
Người mẹ có thể giải thích nhẹ nhàng:“Cháu không xem điện thoại, cháu đang học cách tự bình tĩnh”""Cháu không tham gia hoạt động này vì gia đình không có thời gian để cùng đồng hành""Một chiến lược khác là xây dựng cộng đồng nhỏ của những người chia sẻ giá trị tương tự, những nhóm phụ huynh ủng hộ hạn chế màn hình, kiểu “microculture of conviction” nền văn hóa vi mô của niềm tin.
Chúng giúp các bậc cha mẹ không cảm thấy cô lập, đồng thời tạo nên những hạt nhân nhỏ cho thay đổi xã hội.Cuối cùng, quan trọng hơn hết, là chấp nhận sự khó chịu của người khác như một phần tự nhiên của tiến hóa xã hội. Tiếng ồn của trẻ em, sự từ chối của phụ huynh không phải là vấn đề. Đó là dấu hiệu rằng xã hội vẫn còn chỗ cho sự sống thật, chưa hoàn toàn bị kỹ thuật hóa và kiểm soát hóa.Vấn đề không nằm ở việc cho hay không cho trẻ xem điện thoại hay bắt chước xu hướng tiktok. Nó nằm ở việc xã hội muốn loại người nào bước ra từ tuổi thơ ấy.
Nếu chúng ta tiếp tục đồng nhất “ngoan” với “im lặng” và “phục tùng”, chúng ta đang xây dựng một thế hệ giỏi tuân thủ nhưng kém tự chủ, hiền lành nhưng thiếu năng lực sáng tạo và phản biện.
Ngược lại, nếu dám chịu đựng tiếng ồn, sự hỗn loạn, những câu hỏi bất tận của trẻ, ta đang nuôi dưỡng những con người biết đặt câu hỏi và biết lắng nghe câu trả lời của chính mình.Người mẹ trong câu chuyện, xét đến cùng, không phải đang chống lại xã hội. Cô chỉ đang giữ lại một phần tự nhiên con người giữa thời đại an thần kỹ thuật số, nơi im lặng được đánh đồng với ngoan ngoãn, và ngoan ngoãn bị nhầm với hạnh phúc. Chính từ những tiếng nói nhỏ bé như vậy của một người mẹ giữ vững nguyên tắc giữa đám đông dễ dãi xã hội mới có cơ hội trưởng thành thật sự.36...",,"""Tôi là một người quyết tâm không cho con 4 tuổi nghiện điện thoại. Con trai tôi rất ngoan trừ một điểm là cháu rất hiếu động và hay...",2025-11-05 03:22:43.444+00,2025-11-05 03:22:45.661818+00,1651,success,,2025-11-05 03:22:45.661818+00,2025-11-05 03:22:45.661818+00,http://localhost:54321/storage/v1/object/public/article-screenshots/749d7c56c734de44e4ac87887d86e66278ecd4b16a0e87155a68c2ccd4ccfdb1.jpg,Nuôi dạy trẻ ở Việt Nam: Xung đột giữa Giá trị Cá nhân và Chuẩn mực Cộng đồng,"""Tôi là một người quyết tâm không cho con 4 tuổi nghiện điện thoại. Con trai tôi rất ngoan trừ một điểm là cháu rất hiếu động và hay...",https://images.spiderum.com/sp-images/cda38600b70911f082f5316353d37a3a.png,website,Spiderum,"""Tôi là một người quyết tâm không cho con 4 tuổi nghiện điện thoại. Con trai tôi rất ngoan trừ một điểm là cháu rất hiếu động và hay...",,a0eebc99-9c0b-4ef8-bb6d-6bb9bd380a11,pending,
0eecb1c6-b3c6-49ed-ab21-438c06142b30,https://spiderum.com/nguoi-dung/Sang1982,bbd4978305424f8c595bbe1c43ea88c0df549cc0f59c0bde074539dcad3dcf9b,6f161388-a1e9-4976-ab11-e56f3c317f62,Sangdo,"4 phút đọcCÀ SA VÀ GUCCI  Điều gì khác nhau giữa một cô gái mê đầm dạ hội với một thầy tu mê cà sa?  29/10/2025 5 phút đọcĐẶC ĐIỂM CỦA ÔNG THẦY ĐỂU Mới nhất, có tin thầy T bị tóm khiến bao người vỡ mộng. Tôi viết bài này mong có thể giúp cộng đồng tỉnh ngộ.   25/08/2025 6 phút đọcĐẦU TƯ DU HỌC NÊN CHĂNG? Du học có thật sự cần thiết cho tất cả mọi người? Ai nên du học, ai không?  10/07/2025 5 phút đọcTRẢ LẠI ĐỨC PHẬT Hãy giữ hình ảnh Phật trong lòng – chứ đừng nhốt Ngài vào đá cẩm thạch.  24/05/2025 7 phút đọcTIẾNG ANH KHÔNG KHÓ Trân trọng mời các bạn tham dự buổi chia sẻ offline đầu năm của tôi. Đề tài quen thuộc của ELYH nhưng mới mẻ về...  20/02/2025 5 phút đọcNÓI VÀ VIẾT HIỆU QUẢ  Viết và nói có nhiều cấp độ rèn luyện. Một em bé tiểu học và một chính trị gia đều cần và có thể học viết và nói...  10/01/2025 Tải thêm",,THERE IS NO FATE BUT WHAT WE MAKE FOR OURSELVES.,2025-11-05 03:23:17.788+00,2025-11-05 03:23:19.631465+00,180,success,,2025-11-05 03:23:19.631465+00,2025-11-05 03:23:19.631465+00,http://localhost:54321/storage/v1/object/public/article-screenshots/bbd4978305424f8c595bbe1c43ea88c0df549cc0f59c0bde074539dcad3dcf9b.jpg,Sangdo,"THERE IS NO FATE BUT WHAT WE MAKE FOR OURSELVES. ",https://spiderum.com/assets/images/spiderum-og.png,website,Spiderum,"THERE IS NO FATE BUT WHAT WE MAKE FOR OURSELVES. ",,a0eebc99-9c0b-4ef8-bb6d-6bb9bd380a11,pending,
1109f1ae-16c5-45bb-88fc-d2da84de838e,https://spiderum.com/nguoi-dung/beth13,7d14af2de7dc867dc767d2d51275f6e275f5521916b38b6477e03f140f0714f3,6f161388-a1e9-4976-ab11-e56f3c317f62,call.me.beth," Công ty Cổ Phần Felizz Trực thuộc Công ty Cổ Phần Spiderum Việt Nam (Spiderum Vietnam JSC)Người chịu trách nhiệm nội dung: Trần Việt AnhGiấy phép MXH số 341/GP-TTTT do Bộ TTTT cấp ngày 27 tháng 6 năm 2016© Copyright 2017 - 2023Email: contact@spiderum.comĐiện thoại: (+84) 978 944 558Tầng 11, tòa nhà HL Tower, lô A2B, phố Duy Tân, phường Dịch Vọng Hậu, Cầu Giấy, Hà Nội",,a cautious optimist person,2025-11-05 03:22:33.842+00,2025-11-05 03:22:37.664921+00,68,success,,2025-11-05 03:22:37.664921+00,2025-11-05 03:22:37.664921+00,http://localhost:54321/storage/v1/object/public/article-screenshots/7d14af2de7dc867dc767d2d51275f6e275f5521916b38b6477e03f140f0714f3.jpg,call.me.beth,a cautious optimist person,https://spiderum.com/assets/images/spiderum-og.png,website,Spiderum,a cautious optimist person,,a0eebc99-9c0b-4ef8-bb6d-6bb9bd380a11,pending,
15ef782e-6605-4d2c-90db-309db97383be,https://spiderum.com/danh-muc/du-lich?sort=hot&page_idx=1,ce3d42c8fc36cd3786bcdb9fc4a53ec41603636dc6d56b6998508dca261b1e66,6f161388-a1e9-4976-ab11-e56f3c317f62,Du lịch," Công ty Cổ Phần Felizz Trực thuộc Công ty Cổ Phần Spiderum Việt Nam (Spiderum Vietnam JSC)Người chịu trách nhiệm nội dung: Trần Việt AnhGiấy phép MXH số 341/GP-TTTT do Bộ TTTT cấp ngày 27 tháng 6 năm 2016© Copyright 2017 - 2023Email: contact@spiderum.comĐiện thoại: (+84) 978 944 558Tầng 11, tòa nhà HL Tower, lô A2B, phố Duy Tân, phường Dịch Vọng Hậu, Cầu Giấy, Hà Nội",,Công ty Cổ Phần Felizz,2025-11-05 03:25:18.427+00,2025-11-05 03:25:20.982138+00,68,success,,2025-11-05 03:25:20.982138+00,2025-11-05 03:25:20.982138+00,http://localhost:54321/storage/v1/object/public/article-screenshots/ce3d42c8fc36cd3786bcdb9fc4a53ec41603636dc6d56b6998508dca261b1e66.jpg,Du lịch,,https://spiderum.com/assets/images/spiderum-og.png,website,Spiderum,,,a0eebc99-9c0b-4ef8-bb6d-6bb9bd380a11,pending,
1b6d85f8-7fe8-4183-9abe-a5d7ae2267c8,https://spiderum.com/danh-muc/movie?sort=hot&page_idx=1,95b8f57675560c38d9c1b8ff25bd7340169b927946b380019e7bdfbcff66fccb,6f161388-a1e9-4976-ab11-e56f3c317f62,Movie," Công ty Cổ Phần Felizz Trực thuộc Công ty Cổ Phần Spiderum Việt Nam (Spiderum Vietnam JSC)Người chịu trách nhiệm nội dung: Trần Việt AnhGiấy phép MXH số 341/GP-TTTT do Bộ TTTT cấp ngày 27 tháng 6 năm 2016© Copyright 2017 - 2023Email: contact@spiderum.comĐiện thoại: (+84) 978 944 558Tầng 11, tòa nhà HL Tower, lô A2B, phố Duy Tân, phường Dịch Vọng Hậu, Cầu Giấy, Hà Nội",,Công ty Cổ Phần Felizz,2025-11-05 03:24:12.654+00,2025-11-05 03:24:15.612601+00,68,success,,2025-11-05 03:24:15.612601+00,2025-11-05 03:24:15.612601+00,http://localhost:54321/storage/v1/object/public/article-screenshots/95b8f57675560c38d9c1b8ff25bd7340169b927946b380019e7bdfbcff66fccb.jpg,Movie,,https://spiderum.com/assets/images/spiderum-og.png,website,Spiderum,,,a0eebc99-9c0b-4ef8-bb6d-6bb9bd380a11,pending,
2bb2e50e-c3fc-4666-ad32-d9d19e92ae41,https://spiderum.com/nguoi-dung/rc09,849c6ccba51ea9c113e0722a0abe9f93935c9cc83f7315a0d6835bdd935735f5,6f161388-a1e9-4976-ab11-e56f3c317f62,rc09," Công ty Cổ Phần Felizz Trực thuộc Công ty Cổ Phần Spiderum Việt Nam (Spiderum Vietnam JSC)Người chịu trách nhiệm nội dung: Trần Việt AnhGiấy phép MXH số 341/GP-TTTT do Bộ TTTT cấp ngày 27 tháng 6 năm 2016© Copyright 2017 - 2023Email: contact@spiderum.comĐiện thoại: (+84) 978 944 558Tầng 11, tòa nhà HL Tower, lô A2B, phố Duy Tân, phường Dịch Vọng Hậu, Cầu Giấy, Hà Nội",,Thông tin về,2025-11-05 03:20:40.765+00,2025-11-05 03:20:45.023849+00,68,success,,2025-11-05 03:20:45.023849+00,2025-11-05 03:20:45.023849+00,http://localhost:54321/storage/v1/object/public/article-screenshots/849c6ccba51ea9c113e0722a0abe9f93935c9cc83f7315a0d6835bdd935735f5.jpg,rc09,"Thông tin về ",https://spiderum.com/assets/images/spiderum-og.png,website,Spiderum,"Thông tin về ",,a0eebc99-9c0b-4ef8-bb6d-6bb9bd380a11,pending,
2be7bfa9-b721-485b-b07a-3410eb4d308f,https://spiderum.com/?sort=hot&page_idx=1#feed,59303e5cbad595889e7d79abdf0877c42a7398f4a5d1e43a46a5ef99a6701975,6f161388-a1e9-4976-ab11-e56f3c317f62,Spiderum | Mạng Xã Hội Chia Sẻ Quan Điểm - Kiến Thức Hàng Đầu Việt Nam,"Yêu nước online có đồng nghĩa với suy yếu bản sắc? | happy_666_words Spiderum  20N lượt xem Đầu tư 12 triệu, TIẾT KIỆM TIỀN ĐIỆN suốt 30 năm - Liệu có khả thi? | The Scienceholic | BSS4VN Spiderum  30N lượt xem Việt Nam và hành trình ""chuyển hướng"" sang năng lượng tái tạo | The Scienceholic Spiderum  11N lượt xem Cách mạng năng lượng: Việt Nam HỌC ĐƯỢC GÌ TỪ THẾ GIỚI? | The Scienceholic Spiderum  6.7N lượt xem ",,Nền tảng chia sẻ - thảo luận dành cho người Việt. Nơi tập trung những nội dung thú vị và hữu ích nhất do người dùng đóng góp và bình chọn.,2025-11-05 03:26:39.379+00,2025-11-05 03:26:42.472511+00,81,success,,2025-11-05 03:26:42.472511+00,2025-11-05 03:26:42.472511+00,http://localhost:54321/storage/v1/object/public/article-screenshots/59303e5cbad595889e7d79abdf0877c42a7398f4a5d1e43a46a5ef99a6701975.jpg,Spiderum | Mạng Xã Hội Chia Sẻ Quan Điểm - Kiến Thức Hàng Đầu Việt Nam,Nền tảng chia sẻ - thảo luận dành cho người Việt. Nơi tập trung những nội dung thú vị và hữu ích nhất do người dùng đóng góp và bình chọn.,https://spiderum.com/assets/images/spiderum-og.png,website,Spiderum,Nền tảng chia sẻ - thảo luận dành cho người Việt. Nơi tập trung những nội dung thú vị và hữu ích nhất do người dùng đóng góp và bình chọn.,,a0eebc99-9c0b-4ef8-bb6d-6bb9bd380a11,pending,
3016b124-fce5-497f-ac51-af253ae17aa8,https://spiderum.com/danh-muc/nhiep-anh?sort=hot&page_idx=1,0790855cd3aea147debf7d1910270db36c4fdc93de7b180fcfdec235ead898a2,6f161388-a1e9-4976-ab11-e56f3c317f62,Nhiếp ảnh," Công ty Cổ Phần Felizz Trực thuộc Công ty Cổ Phần Spiderum Việt Nam (Spiderum Vietnam JSC)Người chịu trách nhiệm nội dung: Trần Việt AnhGiấy phép MXH số 341/GP-TTTT do Bộ TTTT cấp ngày 27 tháng 6 năm 2016© Copyright 2017 - 2023Email: contact@spiderum.comĐiện thoại: (+84) 978 944 558Tầng 11, tòa nhà HL Tower, lô A2B, phố Duy Tân, phường Dịch Vọng Hậu, Cầu Giấy, Hà Nội",,Công ty Cổ Phần Felizz,2025-11-05 03:25:45.205+00,2025-11-05 03:25:47.54677+00,68,success,,2025-11-05 03:25:47.54677+00,2025-11-05 03:25:47.54677+00,http://localhost:54321/storage/v1/object/public/article-screenshots/0790855cd3aea147debf7d1910270db36c4fdc93de7b180fcfdec235ead898a2.jpg,Nhiếp ảnh,,https://spiderum.com/assets/images/spiderum-og.png,website,Spiderum,,,a0eebc99-9c0b-4ef8-bb6d-6bb9bd380a11,pending,
31814417-7562-4440-979a-ae60c2227564,https://spiderum.com/danh-muc/the-brands?sort=hot&page_idx=1,19224c6fea94194027ce437ab445c0e593f942f1853bd7617f4c37bd2f8119c9,6f161388-a1e9-4976-ab11-e56f3c317f62,The Brands," Công ty Cổ Phần Felizz Trực thuộc Công ty Cổ Phần Spiderum Việt Nam (Spiderum Vietnam JSC)Người chịu trách nhiệm nội dung: Trần Việt AnhGiấy phép MXH số 341/GP-TTTT do Bộ TTTT cấp ngày 27 tháng 6 năm 2016© Copyright 2017 - 2023Email: contact@spiderum.comĐiện thoại: (+84) 978 944 558Tầng 11, tòa nhà HL Tower, lô A2B, phố Duy Tân, phường Dịch Vọng Hậu, Cầu Giấy, Hà Nội",,Công ty Cổ Phần Felizz,2025-11-05 03:24:45.227+00,2025-11-05 03:24:47.570336+00,68,success,,2025-11-05 03:24:47.570336+00,2025-11-05 03:24:47.570336+00,http://localhost:54321/storage/v1/object/public/article-screenshots/19224c6fea94194027ce437ab445c0e593f942f1853bd7617f4c37bd2f8119c9.jpg,The Brands,,https://spiderum.com/assets/images/spiderum-og.png,website,Spiderum,,,a0eebc99-9c0b-4ef8-bb6d-6bb9bd380a11,pending,
36715b2b-2a1d-413f-89cd-279a7c6641ad,https://spiderum.com/danh-muc/nguoi-trong-muon-nghe?sort=hot&page_idx=1,68f380e16609d6d274f73fe50559b9a2c7fa8f74524e7b9c350ca85330f7c751,6f161388-a1e9-4976-ab11-e56f3c317f62,Người trong muôn nghề," Công ty Cổ Phần Felizz Trực thuộc Công ty Cổ Phần Spiderum Việt Nam (Spiderum Vietnam JSC)Người chịu trách nhiệm nội dung: Trần Việt AnhGiấy phép MXH số 341/GP-TTTT do Bộ TTTT cấp ngày 27 tháng 6 năm 2016© Copyright 2017 - 2023Email: contact@spiderum.comĐiện thoại: (+84) 978 944 558Tầng 11, tòa nhà HL Tower, lô A2B, phố Duy Tân, phường Dịch Vọng Hậu, Cầu Giấy, Hà Nội",,Công ty Cổ Phần Felizz,2025-11-05 03:24:37.08+00,2025-11-05 03:24:39.778435+00,68,success,,2025-11-05 03:24:39.778435+00,2025-11-05 03:24:39.778435+00,http://localhost:54321/storage/v1/object/public/article-screenshots/68f380e16609d6d274f73fe50559b9a2c7fa8f74524e7b9c350ca85330f7c751.jpg,Người trong muôn nghề,,https://spiderum.com/assets/images/spiderum-og.png,website,Spiderum,,,a0eebc99-9c0b-4ef8-bb6d-6bb9bd380a11,pending,
403c88b8-010e-4cdf-9d83-162eb00b8155,https://spiderum.com/danh-muc/xe-may?sort=hot&page_idx=1,80eebadba65d05f4d981937893d09ad981c16bab8610cec47dbe240faa6b98cf,6f161388-a1e9-4976-ab11-e56f3c317f62,Xe máy," Công ty Cổ Phần Felizz Trực thuộc Công ty Cổ Phần Spiderum Việt Nam (Spiderum Vietnam JSC)Người chịu trách nhiệm nội dung: Trần Việt AnhGiấy phép MXH số 341/GP-TTTT do Bộ TTTT cấp ngày 27 tháng 6 năm 2016© Copyright 2017 - 2023Email: contact@spiderum.comĐiện thoại: (+84) 978 944 558Tầng 11, tòa nhà HL Tower, lô A2B, phố Duy Tân, phường Dịch Vọng Hậu, Cầu Giấy, Hà Nội",,Công ty Cổ Phần Felizz,2025-11-05 03:23:46.754+00,2025-11-05 03:23:48.756597+00,68,success,,2025-11-05 03:23:48.756597+00,2025-11-05 03:23:48.756597+00,http://localhost:54321/storage/v1/object/public/article-screenshots/80eebadba65d05f4d981937893d09ad981c16bab8610cec47dbe240faa6b98cf.jpg,Xe máy,,https://spiderum.com/assets/images/spiderum-og.png,website,Spiderum,,,a0eebc99-9c0b-4ef8-bb6d-6bb9bd380a11,pending,
4db6b9ad-3f79-4b1c-a2d6-f391e1636a13,https://spiderum.com/danh-muc/goc-nhin-thoi-su?sort=hot&page_idx=1,af0b2ff224bd9331c28bbcde965fed873cdc8aa738d5410d747a8c66a28f481b,6f161388-a1e9-4976-ab11-e56f3c317f62,Góc nhìn thời sự," Công ty Cổ Phần Felizz Trực thuộc Công ty Cổ Phần Spiderum Việt Nam (Spiderum Vietnam JSC)Người chịu trách nhiệm nội dung: Trần Việt AnhGiấy phép MXH số 341/GP-TTTT do Bộ TTTT cấp ngày 27 tháng 6 năm 2016© Copyright 2017 - 2023Email: contact@spiderum.comĐiện thoại: (+84) 978 944 558Tầng 11, tòa nhà HL Tower, lô A2B, phố Duy Tân, phường Dịch Vọng Hậu, Cầu Giấy, Hà Nội",,Công ty Cổ Phần Felizz,2025-11-05 03:25:51.643+00,2025-11-05 03:25:53.968199+00,68,success,,2025-11-05 03:25:53.968199+00,2025-11-05 03:25:53.968199+00,http://localhost:54321/storage/v1/object/public/article-screenshots/af0b2ff224bd9331c28bbcde965fed873cdc8aa738d5410d747a8c66a28f481b.jpg,Góc nhìn thời sự,,https://spiderum.com/assets/images/spiderum-og.png,website,Spiderum,,,a0eebc99-9c0b-4ef8-bb6d-6bb9bd380a11,pending,
